{
  "$schema": "https://json-schema.org/draft/2020-12/schema",
  "$id": "schemas/envelope.v1.json",
  "title": "Event Envelope v1",
  "type": "object",
  "required": [
    "event_id",
    "event_type",
    "event_version",
    "trace_id",
    "run_id",
    "produced_at",
    "source_service",
    "idempotency_key",
    "payload"
  ],
  "properties": {
    "event_id": {
      "type": "string",
      "minLength": 1
    },
    "event_type": {
      "type": "string",
      "minLength": 1
    },
    "event_version": {
      "type": "string",
      "const": "v1"
    },
    "trace_id": {
      "type": "string",
      "minLength": 1
    },
    "run_id": {
      "type": "string",
      "minLength": 1,
      "pattern": "^[^\\s/\\\\:.]+$"
    },
    "produced_at": {
      "type": "string",
      "format": "date-time"
    },
    "source_service": {
      "type": "string",
      "minLength": 1
    },
    "idempotency_key": {
      "type": "string",
      "minLength": 1
    },
    "payload": {
      "type": "object"
    }
  },
  "additionalProperties": false
}
