{
  "event_id": "evt-metadata-v1-001",
  "event_type": "audio.metadata",
  "event_version": "v1",
  "trace_id": "run/demo-run/track/2",
  "run_id": "other-run",
  "produced_at": "2026-04-02T00:00:00Z",
  "source_service": "ingestion",
  "idempotency_key": "audio.metadata:v1:demo-run:2",
  "payload": {
    "run_id": "demo-run",
    "track_id": 2,
    "artist_id": 1,
    "genre": "Hip-Hop",
    "source_audio_uri": "data/raw/fma_small/000/000002.mp3",
    "validation_status": "validated",
    "duration_s": 29.95,
    "subset": "small",
    "manifest_uri": "/artifacts/runs/demo-run/manifests/segments.parquet",
    "checksum": "sha256:track-000002"
  }
}
