{
  "event_id": "evt-segment-v1-001",
  "event_type": "audio.segment.ready",
  "event_version": "v1",
  "trace_id": "run/demo-run/track/2",
  "run_id": "demo-run",
  "produced_at": "2026-04-02T00:00:05Z",
  "source_service": "ingestion",
  "idempotency_key": "audio.segment.ready:v1:demo-run:2:0",
  "payload": {
    "run_id": "demo-run",
    "track_id": 2,
    "segment_idx": 0,
    "artifact_uri": "/artifacts/runs/demo-run/segments/2/0.wav",
    "checksum": "sha256:segment-000",
    "sample_rate": 32000,
    "duration_s": 3.0,
    "is_last_segment": false,
    "manifest_uri": "/artifacts/runs/demo-run/manifests/segments.parquet"
  }
}
