{
  "event_id": "evt-features-v1-001",
  "event_type": "audio.features",
  "event_version": "v1",
  "trace_id": "run/demo-run/track/2",
  "run_id": "demo-run",
  "produced_at": "2026-04-02T00:00:10Z",
  "source_service": "processing",
  "idempotency_key": "audio.features:v1:demo-run:2:0",
  "payload": {
    "ts": "2026-04-02T00:00:10Z",
    "run_id": "demo-run",
    "track_id": 2,
    "segment_idx": 0,
    "artifact_uri": "/artifacts/runs/demo-run/segments/2/0.wav",
    "checksum": "sha256:segment-000",
    "rms": 0.42,
    "silent_flag": false,
    "mel_bins": 128,
    "mel_frames": 300,
    "processing_ms": 12.5,
    "manifest_uri": "/artifacts/runs/demo-run/manifests/segments.parquet"
  }
}
